{
  "schemaVersion": 1,
  "id": "ksefguard-findings",
  "version": "1.0.0",
  "title": {
    "en": "Synthetic KSeF Guard examples with findings",
    "pl": "Syntetyczne przykłady KSeF Guard z ustaleniami"
  },
  "sourceReferences": [
    {
      "title": "KSeF 2.0 API and integration material",
      "url": "https://github.com/CIRFMF/ksef-api"
    },
    {
      "title": "KSeF certificates",
      "url": "https://ksef.podatki.gov.pl/informacje-ogolne-ksef-20/certyfikaty-ksef/"
    },
    {
      "title": "KSeF offline24",
      "url": "https://ksef.podatki.gov.pl/informacje-ogolne-ksef-20/tryb-offline24/"
    }
  ],
  "scenarios": [
    {
      "id": "certificate-findings",
      "type": "certificate-metadata",
      "fixture": "fixtures/certificate.json",
      "expected": "expected/certificate.json"
    },
    {
      "id": "qr-findings",
      "type": "qr-verification-link",
      "fixture": "fixtures/qr.json",
      "expected": "expected/qr.json"
    },
    {
      "id": "offline-findings",
      "type": "offline24-timeline",
      "fixture": "fixtures/offline.json",
      "expected": "expected/offline.json"
    },
    {
      "id": "retry-findings",
      "type": "retry-recovery-sequence",
      "fixture": "fixtures/retry.json",
      "expected": "expected/retry.json"
    },
    {
      "id": "status-findings",
      "type": "unresolved-status",
      "fixture": "fixtures/status.json",
      "expected": "expected/status.json"
    }
  ]
}
